{
  "$schema": "factory-quality-assessment-v1.schema.json",
  "assessment_version": 1,
  "assessment_id": "RFQ-2026-08-07-KEY-PERSON-RECOVERY-DRILL",
  "assessed_at_utc": "2026-08-07T18:00:00Z",
  "standard_version": "1.0.0",
  "standard_path": "factory/quality/factory-quality-standard-v1.json",
  "standard_sha256": "fd0e51f61c87db90ebff64e33b7f262e51c6c88c351e0f9b3d0c40d25258f4f8",
  "subject": {
    "name": "Research Factory",
    "repository": "https://github.com/Martin123132/research-factory",
    "baseline_revision": "8fdde2a31cc8d914bc7765a32d2e28184fdd4e73",
    "baseline_purpose": "LAST_MERGED_REVISION_BEFORE_THIS_ASSESSMENT"
  },
  "scope_boundary": "CONSTRUCTION_AND_SYNTHETIC_COMMISSIONING_ONLY",
  "profile": "FOUNDATION_ONLY",
  "certifications": {
    "operationally_conformant": false,
    "scientifically_demonstrated": false,
    "independently_audited": false
  },
  "operating_facts": {
    "catalogue_stations": 100,
    "live_research_stations": 0,
    "independent_human_validators_onboarded": 0,
    "observed_live_two_person_reproductions": 0,
    "independent_quality_audits": 0
  },
  "summary": {
    "controls": 28,
    "meets": 21,
    "partial": 5,
    "blocked": 2
  },
  "results": [
    {
      "control_id": "ACCESS-01",
      "critical": true,
      "minimum_evidence_level": "ENFORCED",
      "outcome": "MEETS",
      "evidence_level": "ENFORCED",
      "evidence": [
        {
          "path": "factory/ENGINE.md",
          "sha256": "57d5d85fc99ef288e492b909f712de6589f0a07da74cc2d96b87706fb4ff5416",
          "supports": "Documents the clean-clone core with no hosted account, website, GitHub API or model-provider requirement."
        },
        {
          "path": "factory/engine/tests/test_catalogue.py",
          "sha256": "afd553b8441b0279b985bf66cbd1808f826231183c669e8a4f7c171569d5b19e",
          "supports": "Fails if engine diagnostics introduce a hosted provider dependency."
        }
      ],
      "limitation": null
    },
    {
      "control_id": "ACCESS-02",
      "critical": true,
      "minimum_evidence_level": "ENFORCED",
      "outcome": "MEETS",
      "evidence_level": "ENFORCED",
      "evidence": [
        {
          "path": "GOVERNANCE.md",
          "sha256": "67a38256e0ac108f9f88dd832db7a7719d932f250bee821ab1bce6d1f882d98b",
          "supports": "Makes reproducible evidence rather than credentials or reputation the source of authority."
        },
        {
          "path": "factory/workbench_standard/schema/workbench-contract-v1.schema.json",
          "sha256": "1991ed32b115b6b58d036c0ee240bbe1c72f9567da2300243790dc64ceb60a79",
          "supports": "Defines station gates without academic, employment or affiliation fields."
        }
      ],
      "limitation": null
    },
    {
      "control_id": "ACCESS-03",
      "critical": false,
      "minimum_evidence_level": "ENFORCED",
      "outcome": "PARTIAL",
      "evidence_level": "ENFORCED",
      "evidence": [
        {
          "path": "factory/hangar/ACCESSIBILITY_AUDIT.md",
          "sha256": "bb7fccebf4a1f1f1445d103c1d900a51dc1180692ac4a8239e8edd8a139c498c",
          "supports": "Records the Hangar keyboard, naming, focus and responsive accessibility audit and regression coverage."
        }
      ],
      "limitation": "The Hangar has enforced regression coverage, but a project-wide accommodation process and non-web accessibility audit are not yet implemented."
    },
    {
      "control_id": "ACCESS-04",
      "critical": true,
      "minimum_evidence_level": "ENFORCED",
      "outcome": "MEETS",
      "evidence_level": "ENFORCED",
      "evidence": [
        {
          "path": ".github/scripts/verify_public_readiness.py",
          "sha256": "5bb61f8a7312fcae6b5e92868a4786d9af178fc211edf04092a4ac92521325f6",
          "supports": "Rejects credential-shaped, private, hidden and unsafe public repository paths and keeps candidate intake closed."
        }
      ],
      "limitation": null
    },
    {
      "control_id": "WORK-01",
      "critical": true,
      "minimum_evidence_level": "ENFORCED",
      "outcome": "PARTIAL",
      "evidence_level": "ENFORCED",
      "evidence": [
        {
          "path": "OPEN_FACTORY_CHARTER.md",
          "sha256": "1c29bc144d3a7fd30ef4172373b88d83715e1e1edebb07d47a84955b3b8d2f29",
          "supports": "Requires scope, duration, resources, stop conditions, hazards and evidence class before dispatch."
        },
        {
          "path": "factory/control_plane/schemas/work-order-envelope-v2.schema.json",
          "sha256": "5b2d4d1f3908114fcdf3f79373d14c3795cf29fbdcb331c9d80fcd00c4a08b8f",
          "supports": "Closes commissioning dispatch around one named operator, exact command and interfaces, bounded wall time, output and cost, immutable stop conditions and no in-place extension."
        },
        {
          "path": "factory/control_plane/tests/test_control_plane.py",
          "sha256": "a631789327c782ea5a3b5f83c07792766ff531c23c0464f10a945af02b40948d",
          "supports": "Exercises missing-envelope rejection, human release, monitored receipt and stop-retention paths."
        }
      ],
      "limitation": "Work Order Envelope v2 enforces the local synthetic command, wall-time, output, zero-cost and stop boundary, but materials and hazards remain declarative and the local profile does not isolate network, filesystem or memory."
    },
    {
      "control_id": "WORK-02",
      "critical": true,
      "minimum_evidence_level": "DECLARED",
      "outcome": "MEETS",
      "evidence_level": "ENFORCED",
      "evidence": [
        {
          "path": "OPEN_FACTORY_CHARTER.md",
          "sha256": "1c29bc144d3a7fd30ef4172373b88d83715e1e1edebb07d47a84955b3b8d2f29",
          "supports": "Grants pause, decline and exit without loss of earned attribution or retaliation through scoring or access."
        }
      ],
      "limitation": null
    },
    {
      "control_id": "WORK-03",
      "critical": true,
      "minimum_evidence_level": "ENFORCED",
      "outcome": "PARTIAL",
      "evidence_level": "ENFORCED",
      "evidence": [
        {
          "path": "factory/dispatch/dispatch-budget-v1.schema.json",
          "sha256": "454aea4cfc5f64e9db4eb5ee0ed6a03a3f5b46b778ca5bc5b93b288eae235d73",
          "supports": "Closes agent authority around one accountable human and fixed time, compute, spend, interface, path, network, hazard and stop budgets."
        },
        {
          "path": "factory/dispatch/gate.py",
          "sha256": "442a0bbfc539ba79fb9dcb3ee513f912269f629ce33df7b27c4c87d221f0471e",
          "supports": "Issues an admission ticket only when all 18 dimensions are enforced, rejects the partial frozen runner, source-locks the explicit-protocol container adapter and forbids agent self-expansion."
        },
        {
          "path": "factory/dispatch/container_adapter.py",
          "sha256": "db3845de9ea8da2d4c73ed33b91cb766f00e9b34be0463dbb47670fc73740e92",
          "supports": "Fails closed around digest-pinned exact commands, no network or GPU, bounded Docker resources, readonly declared inputs, human stop, durable hash-bound stdout artifacts and non-promotional receipts."
        },
        {
          "path": "factory/dispatch/container-run-request-v1.schema.json",
          "sha256": "6aeacc1ebfd0cb63cc7dd1d5d870775441ee826c0e21d3028febcea28770ea98",
          "supports": "Closes the container request to a self-hashed budget and ticket binding, digest-pinned image, exact argv, explicit output protocol and declared output path."
        },
        {
          "path": "factory/dispatch/tests/test_container_adapter.py",
          "sha256": "21e722c963be50ef0eb9b7c0a1a7a42865e658127e906192db0b14d7254fbe1e",
          "supports": "Exercises full profile admission, exact-manifest and output-protocol closure, framed artifact rejection, network and path rejection, host probing and an opt-in local digest-pinned Docker commissioning run."
        }
      ],
      "limitation": "The container adapter is commissioning-only and depends on a local Docker trusted computing base. Its portable durable channel is an exact stdout artifact packet; arbitrary temporary /work files are not durable on every Docker host. Its end-to-end check is opt-in local engineering evidence, not an independently attested host, human-identity proof or promotion-grade execution environment."
    },
    {
      "control_id": "WORK-04",
      "critical": false,
      "minimum_evidence_level": "DECLARED",
      "outcome": "MEETS",
      "evidence_level": "DECLARED",
      "evidence": [
        {
          "path": "OPEN_FACTORY_CHARTER.md",
          "sha256": "1c29bc144d3a7fd30ef4172373b88d83715e1e1edebb07d47a84955b3b8d2f29",
          "supports": "Forbids using attempt volume, compute consumption or endurance as substitutes for evidence quality."
        }
      ],
      "limitation": null
    },
    {
      "control_id": "SCIENCE-01",
      "critical": true,
      "minimum_evidence_level": "ENFORCED",
      "outcome": "MEETS",
      "evidence_level": "ENFORCED",
      "evidence": [
        {
          "path": "factory/workbench_standard/schema/workbench-contract-v1.schema.json",
          "sha256": "1991ed32b115b6b58d036c0ee240bbe1c72f9567da2300243790dc64ceb60a79",
          "supports": "The closed station contract requires objective, hard gates, metrics, tolerances, resources and practical guardrails."
        }
      ],
      "limitation": null
    },
    {
      "control_id": "SCIENCE-02",
      "critical": true,
      "minimum_evidence_level": "ENFORCED",
      "outcome": "PARTIAL",
      "evidence_level": "ENFORCED",
      "evidence": [
        {
          "path": "factory/control_plane/workflow.py",
          "sha256": "110edb17393f9ca0bc2969369d7621f570603e904bdd2f26f528ddd8c99c8143",
          "supports": "Implements blind job, rerun, attestation and reveal ordering in the governed state machine."
        }
      ],